{
  "$schema": "https://json-schema.org/draft/2020-12/schema",
  "$id": "https://renox.dev/contracts/meter/v0/meter-record.schema.json",
  "title": "Renox meter batch and record, meter contract version 0.3 (schema_version 0)",
  "description": "Root: one batch envelope (one line of the F1 ndjson sink, one HTTP body in F3). $defs/record: one invocation record. Prose: docs/contracts/meter.md. request_id uniqueness within a batch is rule M1 in validate.ts; the route form per kind, and which kinds carry the realtime fields, are the record's allOf of if/then/else (0.3).",
  "type": "object",
  "additionalProperties": false,
  "required": [
    "schema_version",
    "cell_id",
    "node_id",
    "records"
  ],
  "properties": {
    "$comment": {
      "type": "string"
    },
    "schema_version": {
      "const": 0
    },
    "cell_id": {
      "type": "string",
      "pattern": "^[a-z0-9][a-z0-9_.@-]{0,127}$"
    },
    "node_id": {
      "type": "string",
      "pattern": "^[a-z0-9][a-z0-9_.-]{0,62}$"
    },
    "records": {
      "type": "array",
      "minItems": 1,
      "maxItems": 1000,
      "items": {
        "$ref": "#/$defs/record"
      }
    }
  },
  "$defs": {
    "count": {
      "type": "integer",
      "minimum": 0,
      "maximum": 9007199254740991
    },
    "millis": {
      "type": "number",
      "minimum": 0,
      "description": "Non-negative milliseconds, rounded to 3 decimal places."
    },
    "record": {
      "type": "object",
      "additionalProperties": false,
      "required": [
        "request_id",
        "tenant_id",
        "deployment_hash",
        "route",
        "started_at",
        "cpu_ms",
        "wall_ms",
        "peak_heap_bytes",
        "ingress_bytes",
        "egress_bytes",
        "fetch_sent_bytes",
        "fetch_received_bytes",
        "fetch_blocked",
        "db_ms",
        "db_rows",
        "render_fuel",
        "logs_dropped",
        "http_status",
        "status"
      ],
      "properties": {
        "request_id": {
          "type": "string",
          "pattern": "^[0-9A-Za-z_-]{8,64}$"
        },
        "tenant_id": {
          "type": "string",
          "pattern": "^[a-z0-9][a-z0-9_-]{0,62}$"
        },
        "deployment_hash": {
          "type": "string",
          "pattern": "^[0-9a-f]{64}$"
        },
        "route": {
          "type": "string",
          "description": "<METHOD> <route pattern from manifest.routes[]>, never a concrete URL; for kind event (0.2), EVENT <module> <event name>; from 0.3 WS <pattern> / SSE <pattern> for a realtime connection, TOOL <name> for kind tool, JOB <module> <name> for kind job. From 0.4: IMG <width>w <format> for kind image.",
          "maxLength": 1032,
          "pattern": "^((GET|POST|PUT|PATCH|DELETE|OPTIONS|HEAD|WS|SSE) (/|(/([A-Za-z0-9._~-]+|:[a-z_][a-z0-9_]{0,31}|\\*[a-z_][a-z0-9_]{0,31}))+)|EVENT [a-z][a-z0-9_]{0,31} [a-z][a-z0-9_]{0,31}\\.[a-z][a-z0-9_]{0,63}|TOOL [a-z][a-z0-9_]{0,63}|JOB [a-z][a-z0-9_]{0,31} [a-z][a-z0-9_-]{0,63}|IMG [0-9]{1,5}w (avif|webp|jpeg|png))$"
        },
        "started_at": {
          "$ref": "#/$defs/count",
          "description": "Unix time in milliseconds."
        },
        "cpu_ms": {
          "$ref": "#/$defs/millis"
        },
        "wall_ms": {
          "$ref": "#/$defs/millis"
        },
        "peak_heap_bytes": {
          "$ref": "#/$defs/count"
        },
        "ingress_bytes": {
          "$ref": "#/$defs/count"
        },
        "egress_bytes": {
          "$ref": "#/$defs/count"
        },
        "fetch_sent_bytes": {
          "$ref": "#/$defs/count"
        },
        "fetch_received_bytes": {
          "$ref": "#/$defs/count"
        },
        "fetch_blocked": {
          "$ref": "#/$defs/count"
        },
        "db_ms": {
          "$ref": "#/$defs/millis"
        },
        "db_rows": {
          "$ref": "#/$defs/count"
        },
        "render_fuel": {
          "$ref": "#/$defs/count",
          "description": "Template render fuel of the invocation; 0 when nothing was rendered."
        },
        "render_ms": {
          "$ref": "#/$defs/millis",
          "description": "Optional (0.1): CPU time of rendering on the render pool, outside cpu_ms. Absent = 0."
        },
        "logs_dropped": {
          "$ref": "#/$defs/count"
        },
        "http_status": {
          "type": "integer",
          "minimum": 100,
          "maximum": 599
        },
        "status": {
          "enum": [
            "ok",
            "error",
            "timeout",
            "cpu_limit",
            "oom",
            "blocked_fetch",
            "busy",
            "render_limit",
            "forbidden"
          ]
        },
        "kind": {
          "enum": [
            "request",
            "event",
            "tool",
            "job",
            "image"
          ],
          "description": "Optional (0.2): absent = request. 0.3: tool (one tools/call through /mcp), job (one attempt of a job). 0.4: image (one image variant created on /_img; no tenant code)."
        },
        "authz_evals": {
          "$ref": "#/$defs/count",
          "description": "Optional (0.3): Cedar evaluations of the invocation (ops.md section 17). Absent = 0."
        },
        "realtime_conn_seconds": {
          "type": "number",
          "minimum": 0,
          "description": "Optional (0.3): the lifetime of a ws or sse connection, on its record only. Absent = 0."
        },
        "realtime_messages": {
          "$ref": "#/$defs/count",
          "description": "Optional (0.3): frames received plus messages delivered to the connection, on its record only. Absent = 0."
        },
        "storage_bytes": {
          "type": "integer",
          "minimum": 0,
          "description": "0.4: the tenant's stored bytes after the invocation (ops.md section 21)."
        },
        "image_variants": {
          "type": "integer",
          "minimum": 0,
          "description": "0.4: image variants created."
        },
        "ai_tokens_in": {
          "type": "integer",
          "minimum": 0,
          "description": "0.4: input tokens of ai.chat (ops.md section 23)."
        },
        "ai_tokens_out": {
          "type": "integer",
          "minimum": 0,
          "description": "0.4: output tokens of ai.chat."
        },
        "render_pdf_ms": {
          "type": "number",
          "minimum": 0,
          "description": "0.4: HTML-to-PDF time, outside cpu_ms (ops.md section 24)."
        }
      },
      "allOf": [
        {
          "if": {
            "required": [
              "kind"
            ],
            "properties": {
              "kind": {
                "const": "event"
              }
            }
          },
          "then": {
            "properties": {
              "route": {
                "pattern": "^EVENT "
              },
              "ingress_bytes": {
                "const": 0
              },
              "egress_bytes": {
                "const": 0
              },
              "status": {
                "enum": [
                  "ok",
                  "error",
                  "timeout",
                  "cpu_limit",
                  "oom"
                ]
              }
            }
          }
        },
        {
          "if": {
            "required": [
              "kind"
            ],
            "properties": {
              "kind": {
                "const": "tool"
              }
            }
          },
          "then": {
            "properties": {
              "route": {
                "pattern": "^TOOL "
              },
              "status": {
                "enum": [
                  "ok",
                  "error",
                  "timeout",
                  "cpu_limit",
                  "oom",
                  "blocked_fetch"
                ]
              }
            }
          }
        },
        {
          "if": {
            "required": [
              "kind"
            ],
            "properties": {
              "kind": {
                "const": "job"
              }
            }
          },
          "then": {
            "properties": {
              "route": {
                "pattern": "^JOB "
              },
              "ingress_bytes": {
                "const": 0
              },
              "egress_bytes": {
                "const": 0
              },
              "status": {
                "enum": [
                  "ok",
                  "error",
                  "timeout",
                  "cpu_limit",
                  "oom"
                ]
              }
            }
          }
        },
        {
          "if": {
            "anyOf": [
              {
                "not": {
                  "required": [
                    "kind"
                  ]
                }
              },
              {
                "properties": {
                  "kind": {
                    "const": "request"
                  }
                }
              }
            ]
          },
          "then": {
            "properties": {
              "route": {
                "pattern": "^(GET|POST|PUT|PATCH|DELETE|OPTIONS|HEAD|WS|SSE) "
              }
            }
          },
          "else": {
            "properties": {
              "realtime_conn_seconds": false,
              "realtime_messages": false
            }
          }
        },
        {
          "if": {
            "anyOf": [
              {
                "required": [
                  "realtime_conn_seconds"
                ]
              },
              {
                "required": [
                  "realtime_messages"
                ]
              }
            ]
          },
          "then": {
            "properties": {
              "route": {
                "pattern": "^(WS|SSE) "
              }
            }
          }
        },
        {
          "if": {
            "required": [
              "kind"
            ],
            "properties": {
              "kind": {
                "const": "image"
              }
            }
          },
          "then": {
            "required": [
              "image_variants"
            ],
            "properties": {
              "route": {
                "pattern": "^IMG [0-9]+w (avif|webp|jpeg|png)$"
              },
              "cpu_ms": {
                "const": 0
              },
              "ingress_bytes": {
                "const": 0
              },
              "status": {
                "enum": [
                  "ok",
                  "error"
                ]
              }
            }
          }
        }
      ]
    }
  }
}
