{
  "$comment": "valid (0.2): a request record and the third, failed delivery attempt of billing.invoice_paid to the email module (meter.md section 2, \"Event records\")",
  "schema_version": 0,
  "cell_id": "t_shop@node-dxb-01",
  "node_id": "node-dxb-01",
  "records": [
    {
      "request_id": "01JBQ3Z7MA0000000000000101",
      "tenant_id": "t_shop",
      "deployment_hash": "3597f77a2b9c91728657e3c2b8d45d8e3c05b3eed075edf02d328bbc90e62f64",
      "route": "GET /products/:id",
      "started_at": 1793318400123,
      "cpu_ms": 1.482,
      "wall_ms": 3.917,
      "peak_heap_bytes": 6291456,
      "ingress_bytes": 0,
      "egress_bytes": 41,
      "fetch_sent_bytes": 0,
      "fetch_received_bytes": 0,
      "fetch_blocked": 0,
      "db_ms": 0.211,
      "db_rows": 1,
      "render_fuel": 1840,
      "logs_dropped": 0,
      "http_status": 200,
      "status": "ok",
      "render_ms": 0.214,
      "kind": "request"
    },
    {
      "request_id": "01JBQ3Z7MA0000000000000001_email_3",
      "tenant_id": "t_shop",
      "deployment_hash": "3597f77a2b9c91728657e3c2b8d45d8e3c05b3eed075edf02d328bbc90e62f64",
      "route": "EVENT email billing.invoice_paid",
      "started_at": 1793318400123,
      "cpu_ms": 1.482,
      "wall_ms": 3.917,
      "peak_heap_bytes": 6291456,
      "ingress_bytes": 0,
      "egress_bytes": 0,
      "fetch_sent_bytes": 0,
      "fetch_received_bytes": 0,
      "fetch_blocked": 0,
      "db_ms": 0.211,
      "db_rows": 1,
      "render_fuel": 0,
      "logs_dropped": 0,
      "http_status": 500,
      "status": "error",
      "kind": "event"
    }
  ]
}
