{
  "$comment": "valid (0.3): one WebSocket connection of 12 minutes written at its close, and a guard denial on a page (meter.md section 2, \"Realtime, tool, and job records\")",
  "schema_version": 0,
  "cell_id": "t_shop@node-dxb-01",
  "node_id": "node-dxb-01",
  "records": [
    {
      "request_id": "01JBQ3Z7MA0000000000000501",
      "tenant_id": "t_shop",
      "deployment_hash": "3597f77a2b9c91728657e3c2b8d45d8e3c05b3eed075edf02d328bbc90e62f64",
      "route": "WS /ws/chat/:room",
      "started_at": 1793318400123,
      "cpu_ms": 9.73,
      "wall_ms": 720412.5,
      "peak_heap_bytes": 6291456,
      "ingress_bytes": 12090,
      "egress_bytes": 48211,
      "fetch_sent_bytes": 0,
      "fetch_received_bytes": 0,
      "fetch_blocked": 0,
      "db_ms": 0.211,
      "db_rows": 1,
      "render_fuel": 2200,
      "logs_dropped": 0,
      "http_status": 101,
      "status": "ok",
      "render_ms": 0.91,
      "realtime_conn_seconds": 720.412,
      "realtime_messages": 312,
      "authz_evals": 1
    },
    {
      "request_id": "01JBQ3Z7MA0000000000000502",
      "tenant_id": "t_shop",
      "deployment_hash": "3597f77a2b9c91728657e3c2b8d45d8e3c05b3eed075edf02d328bbc90e62f64",
      "route": "GET /orders/:id",
      "started_at": 1793318400123,
      "cpu_ms": 0.0,
      "wall_ms": 3.917,
      "peak_heap_bytes": 6291456,
      "ingress_bytes": 0,
      "egress_bytes": 1203,
      "fetch_sent_bytes": 0,
      "fetch_received_bytes": 0,
      "fetch_blocked": 0,
      "db_ms": 0.0,
      "db_rows": 0,
      "render_fuel": 380,
      "logs_dropped": 0,
      "http_status": 403,
      "status": "forbidden",
      "render_ms": 0.05,
      "authz_evals": 1
    }
  ]
}
