{
  "schema_version": 0,
  "cell_id": "t_notes@node-dxb-01",
  "node_id": "node-dxb-01",
  "records": [
    {
      "request_id": "01JBQ3Z7M8K5V6W9X2Y4A1B3C5",
      "tenant_id": "t_notes",
      "deployment_hash": "2b91fc0592294b5d6d0c56500b8c5b38af26ed6c9f75198c497c2f529cdbd8f6",
      "route": "GET /api/notes/:id",
      "started_at": 1793318400123,
      "cpu_ms": 1.482,
      "wall_ms": 3.917,
      "peak_heap_bytes": 6291456,
      "ingress_bytes": 0,
      "egress_bytes": 41,
      "fetch_sent_bytes": 0,
      "fetch_received_bytes": 0,
      "fetch_blocked": 0,
      "db_ms": 0.211,
      "db_rows": 1,
      "render_fuel": 0,
      "logs_dropped": 0,
      "http_status": 200,
      "status": "ok"
    },
    {
      "request_id": "01JBQ3Z7MA0000000000000001",
      "tenant_id": "t_notes",
      "deployment_hash": "2b91fc0592294b5d6d0c56500b8c5b38af26ed6c9f75198c497c2f529cdbd8f6",
      "route": "POST /api/notes",
      "started_at": 1793318400410,
      "cpu_ms": 30.004,
      "wall_ms": 31.2,
      "peak_heap_bytes": 9437184,
      "ingress_bytes": 18,
      "egress_bytes": 82,
      "fetch_sent_bytes": 0,
      "fetch_received_bytes": 0,
      "fetch_blocked": 0,
      "db_ms": 0,
      "db_rows": 0,
      "render_fuel": 0,
      "logs_dropped": 0,
      "http_status": 503,
      "status": "cpu_limit"
    },
    {
      "request_id": "01JBQ3Z7MB0000000000000002",
      "tenant_id": "t_notes",
      "deployment_hash": "2b91fc0592294b5d6d0c56500b8c5b38af26ed6c9f75198c497c2f529cdbd8f6",
      "route": "GET /api/notes",
      "started_at": 1793318401002,
      "cpu_ms": 0.903,
      "wall_ms": 2.5,
      "peak_heap_bytes": 6553600,
      "ingress_bytes": 0,
      "egress_bytes": 104,
      "fetch_sent_bytes": 0,
      "fetch_received_bytes": 0,
      "fetch_blocked": 1,
      "db_ms": 0,
      "db_rows": 0,
      "render_fuel": 0,
      "logs_dropped": 0,
      "http_status": 500,
      "status": "blocked_fetch"
    },
    {
      "request_id": "01JBQ3Z7MC0000000000000003",
      "tenant_id": "t_notes",
      "deployment_hash": "2b91fc0592294b5d6d0c56500b8c5b38af26ed6c9f75198c497c2f529cdbd8f6",
      "route": "GET /api/notes",
      "started_at": 1793318401050,
      "cpu_ms": 0,
      "wall_ms": 30000,
      "peak_heap_bytes": 0,
      "ingress_bytes": 0,
      "egress_bytes": 98,
      "fetch_sent_bytes": 0,
      "fetch_received_bytes": 0,
      "fetch_blocked": 0,
      "db_ms": 0,
      "db_rows": 0,
      "render_fuel": 0,
      "logs_dropped": 0,
      "http_status": 503,
      "status": "busy"
    }
  ]
}
