{
  "$comment": "valid (0.3): the first attempt of the app's nightly-report tick, and a failed second attempt of billing's queued send-reminder (meter.md section 2)",
  "schema_version": 0,
  "cell_id": "t_shop@node-dxb-01",
  "node_id": "node-dxb-01",
  "records": [
    {
      "request_id": "01JBQ3Z7MA0000000000000504_1",
      "tenant_id": "t_shop",
      "deployment_hash": "3597f77a2b9c91728657e3c2b8d45d8e3c05b3eed075edf02d328bbc90e62f64",
      "route": "JOB app nightly-report",
      "started_at": 1793318400123,
      "cpu_ms": 12.4,
      "wall_ms": 61.0,
      "peak_heap_bytes": 6291456,
      "ingress_bytes": 0,
      "egress_bytes": 0,
      "fetch_sent_bytes": 0,
      "fetch_received_bytes": 0,
      "fetch_blocked": 0,
      "db_ms": 38.2,
      "db_rows": 1400,
      "render_fuel": 0,
      "logs_dropped": 0,
      "http_status": 200,
      "status": "ok",
      "render_ms": 0.214,
      "kind": "job"
    },
    {
      "request_id": "01JBQ3Z7MA0000000000000401_2",
      "tenant_id": "t_shop",
      "deployment_hash": "3597f77a2b9c91728657e3c2b8d45d8e3c05b3eed075edf02d328bbc90e62f64",
      "route": "JOB billing send-reminder",
      "started_at": 1793318400123,
      "cpu_ms": 1.482,
      "wall_ms": 3.917,
      "peak_heap_bytes": 6291456,
      "ingress_bytes": 0,
      "egress_bytes": 0,
      "fetch_sent_bytes": 0,
      "fetch_received_bytes": 0,
      "fetch_blocked": 0,
      "db_ms": 0.211,
      "db_rows": 1,
      "render_fuel": 0,
      "logs_dropped": 0,
      "http_status": 500,
      "status": "error",
      "render_ms": 0.214,
      "kind": "job"
    }
  ]
}
