{
  "$comment": "valid (0.4): an image variant created on /_img, and a request that stored a file, asked the model and made a PDF (meter.md section 2)",
  "schema_version": 0,
  "cell_id": "t_shop@node-dxb-01",
  "node_id": "node-dxb-01",
  "records": [
    {
      "request_id": "01JBQ3Z7MA0000000000000777",
      "tenant_id": "t_shop",
      "deployment_hash": "3597f77a2b9c91728657e3c2b8d45d8e3c05b3eed075edf02d328bbc90e62f64",
      "route": "IMG 400w avif",
      "started_at": 1793318400123,
      "cpu_ms": 0,
      "wall_ms": 38.5,
      "peak_heap_bytes": 0,
      "ingress_bytes": 0,
      "egress_bytes": 18211,
      "fetch_sent_bytes": 0,
      "fetch_received_bytes": 0,
      "fetch_blocked": 0,
      "db_ms": 0,
      "db_rows": 0,
      "render_fuel": 0,
      "logs_dropped": 0,
      "http_status": 200,
      "status": "ok",
      "kind": "image",
      "image_variants": 1,
      "storage_bytes": 7340032
    },
    {
      "request_id": "01JBQ3Z7MA0000000000000778",
      "tenant_id": "t_shop",
      "deployment_hash": "3597f77a2b9c91728657e3c2b8d45d8e3c05b3eed075edf02d328bbc90e62f64",
      "route": "POST /api/receipts",
      "started_at": 1793318400123,
      "cpu_ms": 12.4,
      "wall_ms": 61.0,
      "peak_heap_bytes": 6291456,
      "ingress_bytes": 0,
      "egress_bytes": 0,
      "fetch_sent_bytes": 0,
      "fetch_received_bytes": 0,
      "fetch_blocked": 0,
      "db_ms": 38.2,
      "db_rows": 1400,
      "render_fuel": 0,
      "logs_dropped": 0,
      "http_status": 200,
      "status": "ok",
      "render_ms": 0.214,
      "ai_tokens_in": 212,
      "ai_tokens_out": 96,
      "render_pdf_ms": 41.2,
      "storage_bytes": 7358243,
      "image_variants": 0
    }
  ]
}
