{
  "$comment": "valid: page records with render_fuel and render_ms, a render_limit record, and a function record without the optional render_ms (meter.md 0.1)",
  "schema_version": 0,
  "cell_id": "t_shop@node-dxb-01",
  "node_id": "node-dxb-01",
  "records": [
    {
      "request_id": "01JBQ3Z7MA0000000000000101",
      "tenant_id": "t_shop",
      "deployment_hash": "3597f77a2b9c91728657e3c2b8d45d8e3c05b3eed075edf02d328bbc90e62f64",
      "route": "GET /products/:id",
      "started_at": 1793318400123,
      "cpu_ms": 1.482,
      "wall_ms": 3.917,
      "peak_heap_bytes": 6291456,
      "ingress_bytes": 0,
      "egress_bytes": 41,
      "fetch_sent_bytes": 0,
      "fetch_received_bytes": 0,
      "fetch_blocked": 0,
      "db_ms": 0.211,
      "db_rows": 1,
      "render_fuel": 1840,
      "logs_dropped": 0,
      "http_status": 200,
      "status": "ok",
      "render_ms": 0.214
    },
    {
      "request_id": "01JBQ3Z7MA0000000000000102",
      "tenant_id": "t_shop",
      "deployment_hash": "3597f77a2b9c91728657e3c2b8d45d8e3c05b3eed075edf02d328bbc90e62f64",
      "route": "GET /products/:id",
      "started_at": 1793318400123,
      "cpu_ms": 1.482,
      "wall_ms": 3.917,
      "peak_heap_bytes": 6291456,
      "ingress_bytes": 0,
      "egress_bytes": 41,
      "fetch_sent_bytes": 0,
      "fetch_received_bytes": 0,
      "fetch_blocked": 0,
      "db_ms": 0.211,
      "db_rows": 1,
      "render_fuel": 100000,
      "logs_dropped": 0,
      "http_status": 500,
      "status": "render_limit",
      "render_ms": 12.5
    },
    {
      "request_id": "01JBQ3Z7MA0000000000000103",
      "tenant_id": "t_shop",
      "deployment_hash": "3597f77a2b9c91728657e3c2b8d45d8e3c05b3eed075edf02d328bbc90e62f64",
      "route": "GET /api/health",
      "started_at": 1793318400123,
      "cpu_ms": 1.482,
      "wall_ms": 3.917,
      "peak_heap_bytes": 6291456,
      "ingress_bytes": 0,
      "egress_bytes": 41,
      "fetch_sent_bytes": 0,
      "fetch_received_bytes": 0,
      "fetch_blocked": 0,
      "db_ms": 0.211,
      "db_rows": 1,
      "render_fuel": 0,
      "logs_dropped": 0,
      "http_status": 200,
      "status": "ok"
    }
  ]
}
